title,url,venue,database_searched,field,year,total_search_hits,industry_1st_author,micro_view,macro_view
Cluster-Adaptive Network A/B Testing: From Randomization to Estimation,https://www.jmlr.org/papers/v25/22-0192.html,Journal of Machine Learning Research,Journal of Machine Learning Research,Computer Science,2024,,0,1,0
Experimental Cost of Information,https://www.jstor.org/stable/27180704?searchText=%28%28experiment%29%20OR%20%28regret%29%20OR%20%28A%2FB%20test%29%20OR%20%28bandit%29%20OR%20%28causal%29%20OR%20%28evaluation%29%20OR%20%28online%20controlled%29%20OR%20%28treatment%29%20OR%20%28decision%29%29%20NOT%20%28%20%28evidence%20from%29%20OR%20%28systematic%29%20OR%20%28meta%20analysis%29%29&searchUri=%2Faction%2FdoBasicSearch%3FQuery%3D%2528%2528experiment%2529%2BOR%2B%2528regret%2529%2BOR%2B%2528A%252FB%2Btest%2529%2BOR%2B%2528bandit%2529%2BOR%2B%2528causal%2529%2BOR%2B%2528evaluation%2529%2BOR%2B%2528online%2Bcontrolled%2529%2BOR%2B%2528treatment%2529%2BOR%2B%2528decision%2529%2529%2BNOT%2B%2528%2B%2528evidence%2Bfrom%2529%2BOR%2B%2528systematic%2529%2BOR%2B%2528meta%2Banalysis%2529%2529%26so%3Drel%26sd%3D2020%26ed%3D2025%26efqs%3DeyJkaXNjIjpbImMzUmhkR2x6ZEdsamN5MWthWE5qYVhCc2FXNWwiLCJiV0Z5YTJGa2RtVnlkQzFrYVhOamFYQnNhVzVsIiwiYldGdWIzSm5ZbVZvWVMxa2FYTmphWEJzYVc1bCIsIlpXTnZibTl0YVdOekxXUnBjMk5wY0d4cGJtVT0iLCJZblZ6YVc1bGMzTXRaR2x6WTJsd2JHbHVaUT09Il0sImN0eSI6WyJhbTkxY201aGJBPT0iXX0%253D%26pagemark%3DeyJwYWdlIjo0LCJzdGFydCI6NzUsInRvdGFsIjozODY1fQ%253D%253D%26groupefq%3DWyJjb250cmlidXRlZF92aWRlbyIsInNlYXJjaF9jaGFwdGVyIiwibXBfcmVzZWFyY2hfcmVwb3J0X3BhcnQiLCJjb250cmlidXRlZF9hdWRpbyIsInJldmlldyIsInNlYXJjaF9hcnRpY2xlIiwicmVzZWFyY2hfcmVwb3J0IiwiY29udHJpYnV0ZWRfdGV4dCJd&ab_segments=0%2Fspellcheck_basic_search%2Ftest&refreqid=fastly-default%3Abb157a6b13abf642785f0ca782ef7a72,AER,JSTOR,Economics,2022,3865,0,0,1
Online field experiments: a selective survey of methods,https://www.cambridge.org/core/journals/journal-of-the-economic-science-association/article/abs/online-field-experiments-a-selective-survey-of-methods/9BEE66E8927D50361B83D0CB4A72B43F,Journal of the Economic Science Association,JSTOR,Economics,2025,,0,1,0
ROI constrained optimal online allocation in sponsored search,https://www.nature.com/articles/s41598-024-77506-3,Nature,Nature,General Science,2024,29,0,1,0
Trustworthy Online Controlled Experiments,https://www.cambridge.org/core/books/trustworthy-online-controlled-experiments/D97B26382EB0EB2DC2019A7A7B518F59,Book,Oxford Academic,Industry,2020,2012,1,1,0
Stratification Trees for Adaptive Randomization in Randomized Controlled Trials,https://www.restud.com/stratification-trees-for-adaptive-randomization-in-randomized-controlled-trials/,Review of Economic Studies,Oxford University Press,Economics,2022,,0,1,0
Experimentation in Endogenous Organizations,https://www.restud.com/experimentation-in-endogenous-organizations/,Review of Economic Studies,Oxford University Press,Economics,2023,52,0,0,1
Policy Targeting under Network Interference,https://www.restud.com/policy-targeting-under-network-interference/,Review of Economic Studies,Oxford University Press,Economics,2024,,0,1,0
How to sample and when to stop sampling: The generalized Wald problem and minimax policies,https://www.restud.com/how-to-sample-and-when-to-stop-sampling-the-generalized-wald-problem-and-minimax-policies/,Review of Economic Studies,Oxford University Press,Economics,2025,,0,1,0
The Surrogate Index: Combining Short-Term Proxies to Estimate Long-Term Treatment Effects More Rapidly and Precisely,https://www.restud.com/the-surrogate-index-combining-short-term-proxies-to-estimate-long-term-treatment-effects-more-rapidly-and-precisely/,Review of Economic Studies,Oxford University Press,Economics,2025,,0,1,0
Improving massive experiments with threshold blocking,https://www.pnas.org/doi/10.1073/pnas.1510504113,PNAS,PNAS,General Science,2016,,0,1,0
Lasso adjustments of treatment effect estimates in randomized experiments,https://www.pnas.org/doi/10.1073/pnas.1510506113,PNAS,PNAS,General Science,2016,,0,1,0
Confidence intervals for policy evaluation in adaptive experiments,https://www.pnas.org/doi/10.1073/pnas.2014602118,PNAS,PNAS,General Science,2021,85,0,1,0
On the number of trials needed to distinguish similar alternatives,https://www.pnas.org/doi/10.1073/pnas.2202116119,PNAS,PNAS,General Science,2022,,0,1,0
On the measure of the information in a statistical experiment,https://projecteuclid.org/journals/bayesian-analysis/volume-2/issue-1/On-the-measure-of-the-information-in-a-statistical-experiment/10.1214/07-BA207.full,Bayesian Analysis,Project Euclid,Statistics,2007,384,0,0,1
"Estimating Average Causal Effects Under General Interference, with Application to a Social Network Experiment.",https://projecteuclid.org/journals/annals-of-applied-statistics/volume-11/issue-3/The-problem-of-infra-marginality-in-outcome-tests-for-discrimination/10.1214/17-AOAS1058.full,Annals of Applied Statistics,Project Euclid,Statistics,2017,,0,1,0
Design and Analysis of Experiments in Networks: Reducing Bias from Interference,https://www.degruyterbrill.com/document/doi/10.1515/jci-2015-0021/html?lang=en&srsltid=AfmBOorwKNlp3KFpuWCxgfG0BMB2TM32pqyGzKtOUViv3s6KSKL08CBV,Statistical Science,Project Euclid,Statistics,2017,,0,1,0
Principles of Experimental Design for Big Data Analysis,https://projecteuclid.org/journals/statistical-science/volume-32/issue-3/Principles-of-Experimental-Design-for-Big-Data-Analysis/10.1214/16-STS604.full,Statistical Science,Project Euclid,Statistics,2017,,0,1,0
Model-assisted design of experiments in the presence of network-correlated outcomes,https://academic.oup.com/biomet/article/105/4/849/5066791,Biometrika,Project Euclid,Statistics,2018,,0,1,0
Minimax designs for causal effects in temporal experiments with treatment habituation,google.com/search?q=Minimax+designs+for+causal+effects+in+temporal+experiments+with+treatment+habituation&rlz=1C5CHFA_enGB1092GB1092&oq=Minimax+designs+for+causal+effects+in+temporal+experiments+with+treatment+habituation&gs_lcrp=EgZjaHJvbWUyBggAEEUYOdIBBzYxOWowajSoAgCwAgA&sourceid=chrome&ie=UTF-8,Biometrika,Project Euclid,Statistics,2019,504,0,1,0
Testing for arbitrary interference on experimentation platforms,https://academic.oup.com/biomet/article/106/4/929/5578431?searchresult=1,Biometrika,Project Euclid,Statistics,2019,,0,0,1
Sequential Bayesian Experimental Design for Implicit Models via Mutual Information,https://projecteuclid.org/journals/bayesian-analysis/volume-16/issue-3/Sequential-Bayesian-Experimental-Design-for-Implicit-Models-via-Mutual-Information/10.1214/20-BA1225.full,Bayesian Analysis,Project Euclid,Statistics,2021,,0,1,0
Asymptotically optimal sequential multiple testing with asynchronous decisions,https://projecteuclid.org/journals/bernoulli/volume-31/issue-1/Asymptotically-optimal-sequential-multiple-testing-with-asynchronous-decisions/10.3150/24-BEJ1727.short,Bernoulli,Project Euclid,Statistics,2025,,0,1,0
A Bayesian Decision Theoretic Model of Sequential Experimentation with Delayed Response,https://academic.oup.com/jrsssb/article/79/5/1439/7041089?searchresult=1,JRSS:B,Royal Statistical Society,Statistics,2017,,0,1,0
Long-term causal inference under persistent confounding via data combination,https://academic.oup.com/jrsssb/article/87/2/362/7811312?searchresult=1,JRSS:B,Royal Statistical Society,Statistics,2024,,0,1,0
Policy evaluation for temporal and/or spatial dependent experiments,https://academic.oup.com/jrsssb/article/86/3/623/7511800?searchresult=1,JRSS:B,Royal Statistical Society,Statistics,2024,,0,1,0
Adaptive experiments toward learning treatment effect heterogeneity,google.com/url?q=https://academic.oup.com/jrsssb/article-abstract/87/4/1055/8037939?redirectedFrom%3Dfulltext&sa=D&source=editors&ust=1763749405975465&usg=AOvVaw2vBRgyhpLlsjWq_noXWpHG,JRSS:B,Royal Statistical Society,Statistics,2025,24,0,1,0
Unwitting Participants at Our Expense: A/B Testing and Digital Exploitation,https://journals.sagepub.com/doi/full/10.1177/00076503231212842,Business & Society,SAGE journals,Organizational Behavior,2023,,0,1,0
Where A/B Testing Goes Wrong: How Divergent Delivery Affects What Online Experiments Cannot (and Can) Tell You About How Customers Respond to Advertising,https://journals.sagepub.com/doi/abs/10.1177/00222429241275886,Journal of Marketing,SAGE journals,Marketing,2024,,0,1,0
Experimentation Culture: Defend Learning against Intellectual Laziness,https://journals.sagepub.com/doi/full/10.1177/26941058241301626,Management and Business Review,SAGE journals,Organizational Behavior,2024,,0,1,0
Methodological Pluralism and Innovation in Data-Driven Organizations*,https://journals.sagepub.com/doi/full/10.1177/00018392251313737,Administrative Science Quarterly,SAGE journals,Organizational Behavior,2025,53,0,0,1
We’re doing it live: A multi-method empirical study on continuous experimentation,https://www.sciencedirect.com/science/article/abs/pii/S0950584917302136,Information and Software Technology,ScienceDirect,Computer Science,2018,,0,1,0
Multi-armed bandits in the wild: Pitfalls and strategies in online experiments,https://www.sciencedirect.com/science/article/abs/pii/S0950584919301053,Information and Software Technology,ScienceDirect,Computer Science,2019,,0,1,0
Controlled experimentation in continuous experimentation: Knowledge and challenges,https://www.sciencedirect.com/science/article/pii/S0950584921000367,Information and Software Technology,ScienceDirect,Computer Science,2021,,0,1,0
Comparison of multi-criteria decision-making methods for online controlled experiments in a launch decision-making framework,https://www.sciencedirect.com/science/article/abs/pii/S0950584922002245,Information and Software Technology,ScienceDirect,Computer Science,2022,405,0,1,0
The A/B testing problem with Gaussian priors☆,https://www.sciencedirect.com/science/article/abs/pii/S002205312300042X,Journal of Economic Theory,ScienceDirect,Economics,2023,,0,0,1
A multi-objective evolutionary approach towards automated online controlled experiments,https://www.sciencedirect.com/science/article/abs/pii/S0164121223000985,Journal of Systems and Software,ScienceDirect,Computer Science,2023,,0,1,0
Decentralized decision-making and scaled autonomy at Spotify.,https://www.sciencedirect.com/science/article/pii/S0164121223000444,Journal of Systems and Software,ScienceDirect,Computer Science,2023,,0,0,1
A/B testing: A systematic literature review☆,https://www.sciencedirect.com/science/article/pii/S0164121224000542,Journal of Systems and Software,ScienceDirect,Computer Science,2024,,0,1,0
"Personalization and targeting: how to experiment, learn & optimize",https://www.sciencedirect.com/science/article/pii/S016781162500062X,International Journal of Research in Marketing,ScienceDirect,Marketing,2025,,0,1,0
Overcoming experimentation challenges in software ecosystems of large product and service organizations: A participatory action research study,https://www.sciencedirect.com/science/article/abs/pii/S0164121225002195,Journal of Systems and Software,ScienceDirect,Computer Science,2025,,1,1,0
Minimax and the value of information,https://link.springer.com/article/10.1007/s11238-014-9442-3,Theory and Decision,Springer,Economics,2015,,0,1,0
The value of information in stopping problems,https://link.springer.com/article/10.1007/s00199-023-01543-8,Economic Theory,Springer,Economics,2024,,0,1,0
A/B Testing with Fat Tails,https://papers.ssrn.com/sol3/papers.cfm?abstract_id=3171224,SSRN,SSRN,Preprints,2019,,0,0,1
Test & Roll: Profit-Maximizing A/B Tests,https://papers.ssrn.com/sol3/papers.cfm?abstract_id=3274875,SSRN,SSRN,Preprints,2019,,0,0,1
Limiting Bias from Test-Control Interference in Online Marketplace Experiments,https://papers.ssrn.com/sol3/papers.cfm?abstract_id=3583596,SSRN,SSRN,Preprints,2020,,0,1,0
Ensembling Experiments to Optimize Interventions along Customer Journey: A Reinforcement Learning Approach,https://papers.ssrn.com/sol3/papers.cfm?abstract_id=3939073,SSRN,SSRN,Preprints,2021,,0,1,0
A Multi-Objective Evolutionary Approach Towards Automated Online Controlled Experiments,https://papers.ssrn.com/sol3/papers.cfm?abstract_id=4252209,SSRN,SSRN,Preprints,2022,,0,1,0
A Two-Part Machine Learning Approach to Characterizing Network Interference in A/B Testing,https://papers.ssrn.com/sol3/papers.cfm?abstract_id=4212172,SSRN,SSRN,Preprints,2022,,0,1,0
"Non-stationary A/B Tests: Optimal Variance Reduction, Bias Correction, and Valid Inference",https://papers.ssrn.com/sol3/papers.cfm?abstract_id=4557431,SSRN,SSRN,Preprints,2022,,0,1,0
A/B Testing: A Systematic Literature Review,https://papers.ssrn.com/sol3/papers.cfm?abstract_id=4549495,SSRN,SSRN,Preprints,2023,,0,1,0
Asymptotically Optimal Adaptive A/B tests for Average Treatment Effect,https://papers.ssrn.com/sol3/papers.cfm?abstract_id=4642974,SSRN,SSRN,Preprints,2023,,0,1,0
Optimal Prototyping on Experimentation Platforms,https://papers.ssrn.com/sol3/papers.cfm?abstract_id=4630349,SSRN,SSRN,Preprints,2023,,0,0,1
A/B Test and Online Experiment Under Diminishing Marginal Effects: Regret Minimization and Statistical Inference,https://papers.ssrn.com/sol3/papers.cfm?abstract_id=4640583,SSRN,SSRN,Preprints,2024,,0,1,0
Large Language Model Assisted Experiment Design with Generative Human-Behavior Agents,https://papers.ssrn.com/sol3/papers.cfm?abstract_id=4874140,SSRN,SSRN,Preprints,2024,,0,1,0
Decision Analytics of Switchback Experiments: A Robust Optimization Approach,https://papers.ssrn.com/sol3/papers.cfm?abstract_id=5245482,SSRN,SSRN,Preprints,2025,,0,1,0
Designing Causal Experiments in Multiunit Enterprises with a Small Sample and Strategic Agents,https://papers.ssrn.com/sol3/papers.cfm?abstract_id=5119999,SSRN,SSRN,Preprints,2025,,0,1,0
Ranking by Lifts: A Cost-Benefit Approach to Large-Scale A/B Tests,https://papers.ssrn.com/sol3/papers.cfm?abstract_id=5124306,SSRN,SSRN,Preprints,2025,,0,1,0
The Interplay between Design and Analysis of Experiments in Complex Environments: Interference and Randomization Tests,https://papers.ssrn.com/sol3/papers.cfm?abstract_id=5239355,SSRN,SSRN,Preprints,2025,,0,1,0
Informative or Actionable? Implementation Constraints And Business Experimentation,https://papers.ssrn.com/sol3/papers.cfm?abstract_id=4945550,SSRN,SSRN,Preprints,2025,,0,0,1
A Nonparametric Bayesian Analysis of Heterogenous Treatment Effects in Digital Experimentation,https://www.tandfonline.com/doi/full/10.1080/07350015.2016.1172013,JBES,Taylor Francis,Statistics,2016,,0,1,
"Funnel testing in webpage optimisation: representation, design and analysis",https://www.tandfonline.com/doi/full/10.1080/24754269.2017.1332964,Statistical Theory and Related Fields,Taylor Francis,Statistics,2017,,0,1,0
Factorial Designs for Online Experiments,https://www.tandfonline.com/doi/full/10.1080/00401706.2019.1701556,Technometrics,Taylor Francis,Statistics,2019,,0,1,0
Dynamic Causal Effects Evaluation in A/B Testing with a Reinforcement Learning Framework,https://www.tandfonline.com/doi/full/10.1080/01621459.2022.2027776,JASA,Taylor Francis,Statistics,2022,111,0,1,0
Locally Optimal Design for A/B Tests in the Presence of Covariates and Network Dependence,https://www.tandfonline.com/doi/full/10.1080/00401706.2022.2046169,Technometrics,Taylor Francis,Statistics,2022,,0,1,0
Novelty and Primacy: A Long-Term Estimator for Online Experiments,https://www.tandfonline.com/doi/full/10.1080/00401706.2022.2124309,Technometrics,Taylor Francis,Statistics,2022,,0,1,0
Toward Optimal Variance Reduction in Online Controlled Experiments,https://www.tandfonline.com/doi/full/10.1080/00401706.2022.2142670,Technometrics,Taylor Francis,Statistics,2022,,0,1,0
Comparative Probability Metrics: Using Posterior Probabilities to Account for Practical Equivalence in A/B tests,https://www.tandfonline.com/doi/full/10.1080/00031305.2021.2000495,The American Statistician,Taylor Francis,Statistics,2022,,0,1,0
Statistical Challenges in Online Controlled Experiments: A Review of A/B Testing Methodology,https://www.tandfonline.com/doi/full/10.1080/00031305.2023.2257237,The American Statistician,Taylor Francis,Statistics,2023,,0,1,0
Rerandomization Algorithms for Optimal Designs of Network A/B Tests,https://www.tandfonline.com/doi/full/10.1080/00401706.2025.2505438,Technometrics,Taylor Francis,Statistics,2025,,0,1,0
Multi-armed bandit experiment in the online service economy,https://onlinelibrary.wiley.com/doi/10.1002/asmb.2104,Applied Stochastic Models in Business and Industry,Wiley,Operations Research,2015,126,0,1,0
Pareto Optimal Proxy Metrics,https://onlinelibrary.wiley.com/doi/10.1002/asmb.70003,Applied Stochastic Models in Business and Industry,Wiley,Statistics,2025,,0,1,0
Experimentation growth: Evolving trustworthy A/B testing capabilities in online software companies,https://onlinelibrary.wiley.com/doi/10.1002/smr.2113,Software: Evolution and Process,Wiley Online Library,Computer Science,2018,55,0,0,1
Efficient and robust sequential decision making algorithms,https://onlinelibrary.wiley.com/doi/10.1002/aaai.12186,AI Magazine,Wiley Online Library,Computer Science,2024,,0,1,0
t-Testing the Waters: Empirically Validating Assumptions for Reliable A/B-Testing,https://dl.acm.org/doi/10.1145/3705328.3759307,RecSys,,Computer Science,2025,,1,1,0
,,71,,10,,16624,110,306,49